{
  "$schema": "https://jami.studio/schemas/renderer/shared-seam-coverage.schema.json",
  "coverageId": "studio-ui.phase-2.group-a.shared-seams.pass-1",
  "schemaVersion": "2026-06-12.phase-2-shared-seams",
  "generatedFor": "Phase 2 / Group A Studio UI shared contract completion",
  "registryMetadata": {
    "surface": "packages/registry/generated/registry.json",
    "field": "meta.sharedContractFixtureCoverage",
    "expectedCoverageId": "studio-ui.phase-2.group-a.shared-seams.pass-1"
  },
  "ownershipBoundary": {
    "studioUiOwns": [
      "renderer validation",
      "presentation descriptors",
      "registry metadata",
      "display-only action state",
      "token and suite references"
    ],
    "harnessOwns": [
      "runtime execution",
      "policy decisions",
      "tool invocation",
      "memory writes",
      "artifact provenance",
      "capability truth"
    ],
    "importsHarnessRuntime": false
  },
  "cases": [
    { "seam": "runEvent", "case": "start", "harnessSchemaId": "https://jami.studio/schemas/harness/run-event.schema.json", "surface": "presentation", "expectedStatus": "ready", "sampleRef": { "runId": "run_phase2", "events": [{ "eventId": "evt_start", "sequence": 1, "runId": "run_phase2", "eventType": "run.started", "occurredAt": "2026-06-12T00:00:00.000Z" }] } },
    { "seam": "runEvent", "case": "progress", "harnessSchemaId": "https://jami.studio/schemas/harness/run-event.schema.json", "surface": "presentation", "expectedStatus": "ready", "sampleRef": { "runId": "run_phase2", "events": [{ "eventId": "evt_progress", "sequence": 2, "runId": "run_phase2", "eventType": "run.progress", "occurredAt": "2026-06-12T00:00:01.000Z" }] } },
    { "seam": "runEvent", "case": "approval required", "harnessSchemaId": "https://jami.studio/schemas/harness/run-event.schema.json", "surface": "presentation", "expectedStatus": "ready", "sampleRef": { "runId": "run_phase2", "events": [{ "eventId": "evt_approval", "sequence": 3, "runId": "run_phase2", "eventType": "approval.requested", "occurredAt": "2026-06-12T00:00:02.000Z", "policyDecision": { "decision": "needs_approval", "scope": "tools.write" } }] } },
    { "seam": "runEvent", "case": "tool running", "harnessSchemaId": "https://jami.studio/schemas/harness/run-event.schema.json", "surface": "presentation", "expectedStatus": "ready", "sampleRef": { "runId": "run_phase2", "events": [{ "eventId": "evt_tool", "sequence": 4, "runId": "run_phase2", "eventType": "tool.running", "occurredAt": "2026-06-12T00:00:03.000Z" }] } },
    { "seam": "runEvent", "case": "artifact emitted", "harnessSchemaId": "https://jami.studio/schemas/harness/run-event.schema.json", "surface": "presentation", "expectedStatus": "ready", "sampleRef": { "runId": "run_phase2", "events": [{ "eventId": "evt_artifact", "sequence": 5, "runId": "run_phase2", "eventType": "artifact.emitted", "occurredAt": "2026-06-12T00:00:04.000Z" }] } },
    { "seam": "runEvent", "case": "checkpoint saved", "harnessSchemaId": "https://jami.studio/schemas/harness/run-event.schema.json", "surface": "presentation", "expectedStatus": "ready", "sampleRef": { "runId": "run_phase2", "events": [{ "eventId": "evt_checkpoint", "sequence": 6, "runId": "run_phase2", "eventType": "checkpoint.saved", "occurredAt": "2026-06-12T00:00:05.000Z" }] } },
    { "seam": "runEvent", "case": "retrying", "harnessSchemaId": "https://jami.studio/schemas/harness/run-event.schema.json", "surface": "presentation", "expectedStatus": "ready", "sampleRef": { "runId": "run_phase2", "events": [{ "eventId": "evt_retrying", "sequence": 7, "runId": "run_phase2", "eventType": "run.retrying", "occurredAt": "2026-06-12T00:00:06.000Z" }] } },
    { "seam": "runEvent", "case": "cancelling", "harnessSchemaId": "https://jami.studio/schemas/harness/run-event.schema.json", "surface": "presentation", "expectedStatus": "ready", "sampleRef": { "runId": "run_phase2", "events": [{ "eventId": "evt_cancelling", "sequence": 8, "runId": "run_phase2", "eventType": "run.cancelling", "occurredAt": "2026-06-12T00:00:07.000Z" }] } },
    { "seam": "runEvent", "case": "cancelled", "harnessSchemaId": "https://jami.studio/schemas/harness/run-event.schema.json", "surface": "presentation", "expectedStatus": "ready", "sampleRef": { "runId": "run_phase2", "events": [{ "eventId": "evt_cancelled", "sequence": 9, "runId": "run_phase2", "eventType": "run.cancelled", "occurredAt": "2026-06-12T00:00:08.000Z" }] } },
    { "seam": "runEvent", "case": "failed", "harnessSchemaId": "https://jami.studio/schemas/harness/run-event.schema.json", "surface": "presentation", "expectedStatus": "error", "sampleRef": { "runId": "run_phase2", "events": [{ "eventId": "evt_failed", "sequence": 10, "runId": "run_phase2", "eventType": "run.failed", "occurredAt": "2026-06-12T00:00:09.000Z", "message": "failed" }] } },
    { "seam": "runEvent", "case": "recovered", "harnessSchemaId": "https://jami.studio/schemas/harness/run-event.schema.json", "surface": "presentation", "expectedStatus": "ready", "sampleRef": { "runId": "run_phase2", "events": [{ "eventId": "evt_recovered", "sequence": 11, "runId": "run_phase2", "eventType": "run.recovered", "occurredAt": "2026-06-12T00:00:10.000Z" }] } },
    { "seam": "runEvent", "case": "complete", "harnessSchemaId": "https://jami.studio/schemas/harness/run-event.schema.json", "surface": "presentation", "expectedStatus": "ready", "sampleRef": { "runId": "run_phase2", "events": [{ "eventId": "evt_complete", "sequence": 12, "runId": "run_phase2", "eventType": "run.completed", "occurredAt": "2026-06-12T00:00:11.000Z" }] } },
    { "seam": "runEvent", "case": "redacted", "harnessSchemaId": "https://jami.studio/schemas/harness/run-event.schema.json", "surface": "presentation", "expectedStatus": "redacted", "sampleRef": { "runId": "run_phase2", "events": [{ "eventId": "evt_redacted", "sequence": 13, "runId": "run_phase2", "eventType": "run.redacted", "rendererState": "not_requested", "occurredAt": "2026-06-12T00:00:12.000Z", "message": "redacted" }] } },

    { "seam": "uiPayload", "case": "valid primitive tree", "harnessSchemaId": "https://jami.studio/schemas/harness/ui-payload.schema.json", "surface": "renderer", "expectedStatus": "renderable", "fixturePath": "packages/renderer/fixtures/compatibility/valid/ui-payload.basic.json" },
    { "seam": "uiPayload", "case": "nested children", "harnessSchemaId": "https://jami.studio/schemas/harness/ui-payload.schema.json", "surface": "renderer", "expectedStatus": "renderable", "sampleRef": { "payloadId": "uip_nested_children", "children": ["Nested display text is accepted only as inert text."] } },
    { "seam": "uiPayload", "case": "empty state", "harnessSchemaId": "https://jami.studio/schemas/harness/ui-payload.schema.json", "surface": "renderer", "expectedStatus": "renderable", "sampleRef": { "payloadId": "uip_empty_state", "componentRef": { "namespace": "@jami-studio/ui", "name": "panel", "version": "0.0.0" }, "props": { "title": "Empty state", "empty": true } } },
    { "seam": "uiPayload", "case": "long content", "harnessSchemaId": "https://jami.studio/schemas/harness/ui-payload.schema.json", "surface": "renderer", "expectedStatus": "renderable", "sampleRef": { "payloadId": "uip_long_content", "children": ["Long content wraps as text and never becomes HTML or executable code."] } },
    { "seam": "uiPayload", "case": "invalid props", "harnessSchemaId": "https://jami.studio/schemas/harness/ui-payload.schema.json", "surface": "renderer", "expectedStatus": "invalid", "fixturePath": "packages/renderer/fixtures/compatibility/invalid/invalid-payload.bad-props.json" },
    { "seam": "uiPayload", "case": "unsafe values", "harnessSchemaId": "https://jami.studio/schemas/harness/ui-payload.schema.json", "surface": "renderer", "expectedStatus": "invalid", "fixturePath": "packages/renderer/fixtures/compatibility/invalid/invalid-payload.javascript-url.json" },
    { "seam": "uiPayload", "case": "stale vocabulary", "harnessSchemaId": "https://jami.studio/schemas/harness/ui-payload.schema.json", "surface": "renderer", "expectedStatus": "invalid", "fixturePath": "packages/renderer/fixtures/compatibility/invalid/invalid-payload.stale-vocabulary-handshake.json" },
    { "seam": "uiPayload", "case": "unknown component", "harnessSchemaId": "https://jami.studio/schemas/harness/ui-payload.schema.json", "surface": "renderer", "expectedStatus": "unsupported", "fixturePath": "packages/renderer/fixtures/compatibility/valid/unsupported-component.json" },
    { "seam": "uiPayload", "case": "package import", "harnessSchemaId": "https://jami.studio/schemas/harness/ui-payload.schema.json", "surface": "renderer", "expectedStatus": "invalid", "fixturePath": "packages/renderer/fixtures/compatibility/invalid/invalid-payload.package-import.json" },
    { "seam": "uiPayload", "case": "serialized React marker", "harnessSchemaId": "https://jami.studio/schemas/harness/ui-payload.schema.json", "surface": "renderer", "expectedStatus": "invalid", "fixturePath": "packages/renderer/fixtures/compatibility/invalid/invalid-payload.react-element.json" },
    { "seam": "uiPayload", "case": "HTML/script", "harnessSchemaId": "https://jami.studio/schemas/harness/ui-payload.schema.json", "surface": "renderer", "expectedStatus": "invalid", "fixturePath": "packages/renderer/fixtures/compatibility/invalid/invalid-payload.html.json" },
    { "seam": "uiPayload", "case": "handler props", "harnessSchemaId": "https://jami.studio/schemas/harness/ui-payload.schema.json", "surface": "renderer", "expectedStatus": "invalid", "fixturePath": "packages/renderer/fixtures/compatibility/invalid/invalid-payload.event-handler.json" },
    { "seam": "uiPayload", "case": "secret-shaped values", "harnessSchemaId": "https://jami.studio/schemas/harness/ui-payload.schema.json", "surface": "renderer", "expectedStatus": "invalid", "fixturePath": "packages/renderer/fixtures/compatibility/invalid/invalid-payload.inline-secret.json" },